{
  "schema_version": 2,
  "ref_spl": 75.0,
  "mapping_version": 2,
  "root": "tests/golden/fixtures",
  "file_count": 29,
  "files": [
    {
      "path": "bright_outlier.wav",
      "sha256": "a559eaa7ed2706eacf7a0ac051462a07563266c4fc6511d32bba311344c4d446",
      "error": "",
      "duration_s": 0.4,
      "sample_rate": 48000,
      "channels": 1,
      "truncated": false,
      "loudness": {
        "lufs_i": -22.2898,
        "true_peak_db": -6.0172,
        "silent": false
      },
      "features": {
        "centroid_hz": 14428.2682,
        "rolloff85_hz": 21292.9688,
        "flatness": 0.3365,
        "zcr": 0.5878,
        "attack_s": 0.0063,
        "tail_s": 0.3526,
        "tail_clipped": false,
        "roughness": 0.1543,
        "warmth": 0.0,
        "bands": [
          0.0,
          0.0,
          0.0,
          0.0084,
          0.2082,
          0.7835
        ]
      },
      "psycho": {
        "ref_spl": 75.0,
        "sones_n5": 12.9964,
        "sones_mean": 8.0949,
        "sharpness_acum": 3.7316,
        "roughness_asper": 0.0546,
        "fluctuation_vacil": 0.8487,
        "experimental_fluctuation": true
      },
      "visual": {
        "hue_deg": 220.0,
        "sat": 70.0,
        "light": 55.0,
        "size_px": 20.0,
        "ton01": 0.3269,
        "spike01": 0.733,
        "spikes": 11,
        "jitter01": 0.0597,
        "tail01": 0.4771,
        "fluct01": 0.8456,
        "loud01": 0.6008,
        "sharp01": 1.0,
        "silent": false,
        "seed": 9004422993170285738
      }
    },
    {
      "path": "click.wav",
      "sha256": "f644d39c58796ebe541923eb6a0c404ccd642cefb710079ba348a8e58173bb13",
      "error": "",
      "duration_s": 0.5,
      "sample_rate": 48000,
      "channels": 1,
      "truncated": false,
      "loudness": {
        "lufs_i": -26.8181,
        "true_peak_db": 0.1174,
        "silent": false
      },
      "features": {
        "centroid_hz": 7.9376,
        "rolloff85_hz": 23.4375,
        "flatness": 0.001,
        "zcr": 0.0,
        "attack_s": 0.0063,
        "tail_s": 0.2127,
        "tail_clipped": false,
        "roughness": 0.0,
        "warmth": 0.0007,
        "bands": [
          0.9983,
          0.0005,
          0.0001,
          0.0002,
          0.0003,
          0.0006
        ]
      },
      "psycho": {
        "ref_spl": 75.0,
        "sones_n5": 10.8524,
        "sones_mean": 4.8427,
        "sharpness_acum": 1.19,
        "roughness_asper": 0.0523,
        "fluctuation_vacil": 0.9349,
        "experimental_fluctuation": true
      },
      "visual": {
        "hue_deg": 220.0,
        "sat": 70.0,
        "light": 55.0,
        "size_px": 20.0,
        "ton01": 0.998,
        "spike01": 0.7345,
        "spikes": 11,
        "jitter01": 0.0557,
        "tail01": 0.3536,
        "fluct01": 0.9336,
        "loud01": 0.549,
        "sharp01": 0.2034,
        "silent": false,
        "seed": 10810168846404138579
      }
    },
    {
      "path": "darkset/dark_00.wav",
      "sha256": "b8811354edef2641108fec95e0fafa7f382ebffb3cefa77e44cef3a123f38f36",
      "error": "",
      "duration_s": 1.5,
      "sample_rate": 48000,
      "channels": 1,
      "truncated": false,
      "loudness": {
        "lufs_i": -29.7561,
        "true_peak_db": -7.9559,
        "silent": false
      },
      "features": {
        "centroid_hz": 191.0213,
        "rolloff85_hz": 330.6911,
        "flatness": 0.0002,
        "zcr": 0.0125,
        "attack_s": 0.019,
        "tail_s": 0.9885,
        "tail_clipped": false,
        "roughness": 0.2038,
        "warmth": 0.6612,
        "bands": [
          0.2928,
          0.4337,
          0.2274,
          0.0451,
          0.0008,
          0.0
        ]
      },
      "psycho": {
        "ref_spl": 75.0,
        "sones_n5": 16.7595,
        "sones_mean": 5.2301,
        "sharpness_acum": 0.872,
        "roughness_asper": 0.5422,
        "fluctuation_vacil": 0.8214,
        "experimental_fluctuation": true
      },
      "visual": {
        "hue_deg": 32.9419,
        "sat": 70.0,
        "light": 55.0,
        "size_px": 20.0,
        "ton01": 0.9996,
        "spike01": 0.4791,
        "spikes": 9,
        "jitter01": 0.9003,
        "tail01": 0.7288,
        "fluct01": 0.8178,
        "loud01": 0.6823,
        "sharp01": 0.0938,
        "silent": false,
        "seed": 15589315446761457141
      }
    },
    {
      "path": "darkset/dark_01.wav",
      "sha256": "44b9b4fede7cb33ce4569c806095575a63a895f5f1836b720503e9ca177d7aea",
      "error": "",
      "duration_s": 1.5,
      "sample_rate": 48000,
      "channels": 1,
      "truncated": false,
      "loudness": {
        "lufs_i": -27.5158,
        "true_peak_db": -7.953,
        "silent": false
      },
      "features": {
        "centroid_hz": 192.9977,
        "rolloff85_hz": 329.6647,
        "flatness": 0.0002,
        "zcr": 0.0132,
        "attack_s": 0.0188,
        "tail_s": 1.2334,
        "tail_clipped": false,
        "roughness": 0.2035,
        "warmth": 0.6576,
        "bands": [
          0.2957,
          0.4045,
          0.253,
          0.0458,
          0.0009,
          0.0
        ]
      },
      "psycho": {
        "ref_spl": 75.0,
        "sones_n5": 19.9334,
        "sones_mean": 6.6757,
        "sharpness_acum": 0.9039,
        "roughness_asper": 0.6283,
        "fluctuation_vacil": 0.909,
        "experimental_fluctuation": true
      },
      "visual": {
        "hue_deg": 34.1404,
        "sat": 70.0,
        "light": 55.0,
        "size_px": 20.0,
        "ton01": 0.9996,
        "spike01": 0.4809,
        "spikes": 9,
        "jitter01": 1.0,
        "tail01": 0.7829,
        "fluct01": 0.9071,
        "loud01": 0.7441,
        "sharp01": 0.1048,
        "silent": false,
        "seed": 4717451182026746050
      }
    },
    {
      "path": "darkset/dark_02.wav",
      "sha256": "23d1b1964af7713b1833760456c4ab1d21c6bd2d1417ceb940e0fba528cd35b7",
      "error": "",
      "duration_s": 1.5,
      "sample_rate": 48000,
      "channels": 1,
      "truncated": false,
      "loudness": {
        "lufs_i": -27.7004,
        "true_peak_db": -7.9551,
        "silent": false
      },
      "features": {
        "centroid_hz": 194.1085,
        "rolloff85_hz": 326.5853,
        "flatness": 0.0002,
        "zcr": 0.0129,
        "attack_s": 0.0284,
        "tail_s": 1.277,
        "tail_clipped": false,
        "roughness": 0.2016,
        "warmth": 0.6832,
        "bands": [
          0.2682,
          0.466,
          0.2172,
          0.0478,
          0.0008,
          0.0
        ]
      },
      "psycho": {
        "ref_spl": 75.0,
        "sones_n5": 18.7167,
        "sones_mean": 6.6559,
        "sharpness_acum": 0.879,
        "roughness_asper": 0.6785,
        "fluctuation_vacil": 0.8036,
        "experimental_fluctuation": true
      },
      "visual": {
        "hue_deg": 25.5894,
        "sat": 70.0,
        "light": 55.0,
        "size_px": 20.0,
        "ton01": 0.9996,
        "spike01": 0.3858,
        "spikes": 8,
        "jitter01": 1.0,
        "tail01": 0.7914,
        "fluct01": 0.7996,
        "loud01": 0.721,
        "sharp01": 0.0962,
        "silent": false,
        "seed": 6629637249428411627
      }
    },
    {
      "path": "darkset/dark_03.wav",
      "sha256": "a544c9206e0b1e889a726dcc37db142876e1873156769f4cfe3aec52b99263ae",
      "error": "",
      "duration_s": 1.5,
      "sample_rate": 48000,
      "channels": 1,
      "truncated": false,
      "loudness": {
        "lufs_i": -31.4322,
        "true_peak_db": -7.9551,
        "silent": false
      },
      "features": {
        "centroid_hz": 186.0617,
        "rolloff85_hz": 324.3613,
        "flatness": 0.0002,
        "zcr": 0.0124,
        "attack_s": 0.0326,
        "tail_s": 1.4238,
        "tail_clipped": false,
        "roughness": 0.2105,
        "warmth": 0.6516,
        "bands": [
          0.2985,
          0.4251,
          0.2266,
          0.049,
          0.0008,
          0.0
        ]
      },
      "psycho": {
        "ref_spl": 75.0,
        "sones_n5": 15.3217,
        "sones_mean": 5.733,
        "sharpness_acum": 0.8837,
        "roughness_asper": 0.6603,
        "fluctuation_vacil": 0.7389,
        "experimental_fluctuation": true
      },
      "visual": {
        "hue_deg": 36.1205,
        "sat": 70.0,
        "light": 55.0,
        "size_px": 20.0,
        "ton01": 0.9996,
        "spike01": 0.3532,
        "spikes": 8,
        "jitter01": 1.0,
        "tail01": 0.818,
        "fluct01": 0.7336,
        "loud01": 0.6524,
        "sharp01": 0.0978,
        "silent": false,
        "seed": 2000320413893266424
      }
    },
    {
      "path": "darkset/dark_04.wav",
      "sha256": "b0aca469eb529b5a2e1be61cfd14e4ddfafef98e103212b281b7253438f6e0ea",
      "error": "",
      "duration_s": 1.5,
      "sample_rate": 48000,
      "channels": 1,
      "truncated": false,
      "loudness": {
        "lufs_i": -28.5001,
        "true_peak_db": -7.9482,
        "silent": false
      },
      "features": {
        "centroid_hz": 192.9217,
        "rolloff85_hz": 332.9151,
        "flatness": 0.0002,
        "zcr": 0.0125,
        "attack_s": 0.0144,
        "tail_s": 1.4654,
        "tail_clipped": true,
        "roughness": 0.2133,
        "warmth": 0.6685,
        "bands": [
          0.2826,
          0.4381,
          0.2304,
          0.048,
          0.0008,
          0.0
        ]
      },
      "psycho": {
        "ref_spl": 75.0,
        "sones_n5": 18.4068,
        "sones_mean": 7.2629,
        "sharpness_acum": 0.8717,
        "roughness_asper": 0.6009,
        "fluctuation_vacil": 0.6494,
        "experimental_fluctuation": true
      },
      "visual": {
        "hue_deg": 30.484,
        "sat": 70.0,
        "light": 55.0,
        "size_px": 20.0,
        "ton01": 0.9996,
        "spike01": 0.5425,
        "spikes": 9,
        "jitter01": 1.0,
        "tail01": 0.825,
        "fluct01": 0.6423,